{"artifacts":[{"artifact_id":"core:bundle","path":"evidence/bundle.json","role":"evidence_bundle","sha256":"b619388562672887e240d824066b92632c39526ef28c15682379994084ae43b1"},{"artifact_id":"core:descriptor","path":"contracts/dataset_profile.json","role":"dataset_profile_descriptor","sha256":"975478ee302a94e28e48db3e9fa49d5b60b9cd9a10e9fee05e43f61da86658c6"},{"artifact_id":"core:report","path":"reports/conformance.json","role":"profile_conformance_report","sha256":"54fad71ce077b55f4bd854f0606801729e708873dd53665e32d2abe6b9771e38"}],"claims":{"dataset_identity_sha256":"aaaaaaaaaaaaaaaaaaaaaaaaaaaaaaaaaaaaaaaaaaaaaaaaaaaaaaaaaaaaaaaa","evaluation_cutoff":10,"exact_ranks":[1,17],"profile_id":"generator_g0_g5","profile_revision":"1.0.0","publication_depth":100,"rank_semantics":"exact_with_censoring","target_universe_sha256":"bbbbbbbbbbbbbbbbbbbbbbbbbbbbbbbbbbbbbbbbbbbbbbbbbbbbbbbbbbbbbbbb"},"content_sha256":"1d7de520e22e8e0415566d12e9fd88f63959d5c88d8bc30c0216851756813d25","producer":{"name":"third-party.example","version":"0.1.0"},"schema":"sidscope.evidence_submission.v1","schema_revision":"1.0.0","submission_id":"submission:external-parallel"}
